{
  "schemaVersion": 1,
  "platform": "ppsspp",
  "generatedAt": "2026-09-19T14:33:00Z",
  "entries": [
    {
      "id": "imassp-tl-idolmaster-sp-cn-20260919",
      "name": "The Idolmaster SP Chinese High Resolution Texture Pack",
      "gameTitle": "The Idolmaster SP",
      "serials": ["ULJS-00167", "ULJS-00168", "ULJS-00169"],
      "version": "main snapshot 2026-09-19",
      "authors": ["IMASSP-TL contributors"],
      "credits": "Original pack and texture work by the IMASSP-TL contributors. EmuCoreA normalized the upstream repository into a deterministic PPSSPP ZIP while retaining the upstream LICENSE and README.",
      "description": "Chinese high-resolution replacement textures for Perfect Sun, Wandering Star, and Missing Moon. The archive contains textures.ini and the referenced PNG assets only; it does not contain a game image.",
      "downloadUrl": "https://github.com/sashkinbro/EmuCoreA-Textures/releases/download/texture-catalog-2026-09-19/imas-sp-perfect-sun-wandering-star-missing-moon.zip",
      "sourceUrl": "https://github.com/IMASSP-TL/Imas-SP-Texture-Patch-CN",
      "license": "GPL-3.0 for the source repository; see the included LICENSE and upstream project notice for game asset attribution",
      "distribution": "mirrored",
      "sizeBytes": 294486374,
      "sha256": "C0D7E7D6956AC4F5655BF1C5CCDBA88E5772CCC07C1E8A07AE43988D3AB97E15",
      "fileCount": 244,
      "previewUrls": ["https://picui.ogmua.cn/s1/2026/03/24/69c1c927149b7.webp"],
      "sourceRelease": "main"
    },
    {
      "id": "itzantonis2012-gta-liberty-city-stories-20260919",
      "name": "GTA Liberty City Stories PSP Texture Pack",
      "gameTitle": "Grand Theft Auto: Liberty City Stories",
      "serials": ["ULUS-10041"],
      "version": "v1",
      "authors": ["ItzAntonis2012", "SonofUgly", "Mentraze", "ThirteenAG"],
      "credits": "Pack assembled by ItzAntonis2012; source work is credited in the upstream README. EmuCoreA links to the author's release and does not mirror it.",
      "description": "PPSSPP replacement textures for the USA PSP release. The upstream archive includes textures.ini and 292 image assets.",
      "downloadUrl": "https://github.com/ItzAntonis2012/modernizepspgames/releases/download/v1/gtalcs_texturepack_psp.zip",
      "sourceUrl": "https://github.com/ItzAntonis2012/modernizepspgames",
      "license": "No redistribution license stated; link to upstream only",
      "distribution": "link-only",
      "sizeBytes": 6763143,
      "sha256": "2101FDE564F5825F1C4EEA778BD9828895706A7132D42E75A5F83C7C065AB088",
      "fileCount": 292,
      "previewUrls": [],
      "sourceRelease": "v1"
    },
    {
      "id": "itzantonis2012-gta-vice-city-stories-20260919",
      "name": "GTA Vice City Stories PSP Texture Pack",
      "gameTitle": "Grand Theft Auto: Vice City Stories",
      "serials": ["ULUS-10160"],
      "version": "v1",
      "authors": ["ItzAntonis2012", "SonofUgly", "Tervel1337", "ThirteenAG"],
      "credits": "Pack assembled by ItzAntonis2012; source work is credited in the upstream README. EmuCoreA links to the author's release and does not mirror it.",
      "description": "PPSSPP replacement textures for the USA PSP release. The upstream archive includes textures.ini and 219 image assets.",
      "downloadUrl": "https://github.com/ItzAntonis2012/modernizepspgames/releases/download/v1/gtavcs_texturepack_psp.zip",
      "sourceUrl": "https://github.com/ItzAntonis2012/modernizepspgames",
      "license": "No redistribution license stated; link to upstream only",
      "distribution": "link-only",
      "sizeBytes": 4087480,
      "sha256": "B87686EB02A2E2DB165D1AA91C09351EF92E41673313B3C47FAA332FB012C2D4",
      "fileCount": 219,
      "previewUrls": [],
      "sourceRelease": "v1"
    },
    {
      "id": "santiago046-manhunt-2-20260919",
      "name": "Manhunt 2 PSP Texture Pack",
      "gameTitle": "Manhunt 2",
      "serials": ["ULUS-10280", "ULES-00756"],
      "version": "v3.0.1",
      "authors": ["santiago046"],
      "credits": "Texture pack by santiago046. The upstream README prohibits re-uploading; EmuCoreA links to the original release only.",
      "description": "PPSSPP replacement textures for the USA and Europe PSP releases. The upstream archive includes KTX2, ZIMG, and PNG assets.",
      "downloadUrl": "https://github.com/santiago046/ppsspp-mh2-texture-pack/releases/download/v3.0.1/manhunt2-texture-pack-v3.0.1.zip",
      "sourceUrl": "https://github.com/santiago046/ppsspp-mh2-texture-pack",
      "license": "Re-upload prohibited by upstream README; link to original release only",
      "distribution": "link-only",
      "sizeBytes": 123588781,
      "sha256": "F63496D494CD929874ED9A57B415084B86813213C7017A09E4C78D724E78153A",
      "fileCount": 4467,
      "previewUrls": [],
      "sourceRelease": "v3.0.1"
    },
    {
      "id": "althonos-lapucelle-ragnarok-ui-20260919",
      "name": "La Pucelle: Ragnarok PPSSPP HD UI Texture Pack",
      "gameTitle": "La Pucelle: Ragnarok",
      "serials": ["ULJS-00244"],
      "version": "v0.1.0 normalized UI subset",
      "authors": ["althonos"],
      "credits": "Original texture project by althonos; fonts and third-party contributions are credited in the included upstream README. EmuCoreA retains the source README, COPYING.md, CHANGELOG.md, and attribution notice.",
      "description": "A normalized PPSSPP UI/font replacement subset from the upstream release. The upstream release archive contained nine image assets while its textures.ini referenced additional absent files; this derivative removes only those dangling mappings so the archive validates and loads safely.",
      "downloadUrl": "https://github.com/sashkinbro/EmuCoreA-Textures/releases/download/texture-catalog-psp-additional-20260919/lapucelle-uljs00244-ui-v0.1.0-emucorea.zip",
      "sourceUrl": "https://github.com/althonos/lapucelle-textures",
      "license": "CC-NC 1.0 as identified by upstream README; non-commercial redistribution only: https://creativecommons.org/licenses/nc/1.0/",
      "distribution": "mirrored",
      "sizeBytes": 1189408,
      "sha256": "EE5C9E863F83D758858BCF3F4D4FA6D11017AB3B77250F2280859571633AE7E3",
      "fileCount": 9,
      "previewUrls": ["https://raw.githubusercontent.com/althonos/lapucelle-textures/master/static/screen1-new.png"],
      "sourceRelease": "v0.1.0"
    },
    {
      "id": "retokyo-wipeout-pure-hd-20260919",
      "name": "WipEout Pure HD Texture Pack",
      "gameTitle": "WipEout Pure",
      "serials": ["UCES-00001", "UCUS-98612", "UCJS-10007", "ULES-00229", "ULUS-10058"],
      "version": "master snapshot 2026-09-19",
      "authors": ["reTokyo"],
      "credits": "Texture project by reTokyo; Sony/Studio Liverpool copyright and trademark notices are retained in the upstream README. EmuCoreA links to the original repository and does not mirror it.",
      "description": "UI-focused PPSSPP HD texture project for WipEout Pure and listed demo regions. Redistribution permission is not stated, so this catalog keeps the exact upstream ZIP link only.",
      "downloadUrl": "https://github.com/reTokyo/WipEout-Pure-HD-Texture-Pack/archive/refs/heads/master.zip",
      "sourceUrl": "https://github.com/reTokyo/WipEout-Pure-HD-Texture-Pack",
      "license": "No redistribution license stated; upstream copyright notice; link-only",
      "distribution": "link-only",
      "sizeBytes": 7810547,
      "sha256": "E235F024182E6D31BFE0749DACD1D4A4A690121D8DD04A4A215D9B72458C417E",
      "fileCount": 130,
      "previewUrls": [],
      "sourceRelease": "master"
    },
    {
      "id": "sinceohsix-peggle-portable-hd-20260919",
      "name": "Peggle Portable HD Texture Pack (PlayStation layout)",
      "gameTitle": "Peggle",
      "serials": ["NPUG-30040"],
      "version": "latest release snapshot 2026-09-19",
      "authors": ["sinceohsix"],
      "credits": "Pack by sinceohsix. Peggle trademark and original game assets remain with Electronic Arts; EmuCoreA links to the upstream release and does not mirror it.",
      "description": "PPSSPP HD replacement textures for Peggle PSP with the PlayStation controller layout. The upstream archive is preserved as an exact external link because no redistribution license is stated.",
      "downloadUrl": "https://github.com/sinceohsix/PeggleHD/releases/latest/download/NPUG30040-PS.zip",
      "sourceUrl": "https://github.com/sinceohsix/PeggleHD",
      "license": "No redistribution license stated; Electronic Arts trademark notice; link-only",
      "distribution": "link-only",
      "sizeBytes": 58283322,
      "sha256": "DF49CA9CD73476494D9948C1D179B1D000155D52EC0E15BBFED6B6EC622574AE",
      "fileCount": 384,
      "previewUrls": [],
      "sourceRelease": "latest"
    },
    {
      "id": "ezehokadrim-fate-extra-20260919",
      "name": "Fate/Extra PSP HD Texture Pack",
      "gameTitle": "Fate/Extra",
      "serials": ["ULUS-10576"],
      "version": "master snapshot 2026-09-19",
      "authors": ["Ezehokadrim"],
      "credits": "Texture project by Ezehokadrim. The upstream README credits original game rights holders and asks users to credit the author; EmuCoreA links to the original repository and does not mirror it.",
      "description": "PPSSPP replacement textures for the US PSP release. The repository contains a root textures.ini and 1,991 image assets, with 200 referenced images absent from the snapshot; its README does not state a redistribution license or permission, so this entry keeps the exact upstream ZIP link only.",
      "downloadUrl": "https://github.com/Ezehokadrim/fate-extra-texturepack/archive/refs/heads/master.zip",
      "sourceUrl": "https://github.com/Ezehokadrim/fate-extra-texturepack",
      "license": "No redistribution license stated; upstream README requests author credit and reserves original game rights; link-only",
      "distribution": "link-only",
      "sizeBytes": 26250278,